ticket_subject,ticket_body,origin,status,priority,reporter_id,lat,lng
Defective Street Hardware on Henry Street (unique_key: 67079536),"I am writing to report a defective street hardware issue on Henry Street in Brooklyn. Specifically, the hardware in question appears to be a broken or loose manhole cover or street plate at 247 Henry Street, which is causing a hazardous condition for both drivers and pedestrians. The defective hardware is creating a loud noise and a significant bump when driven over, and I am concerned that it may lead to accidents or damage to vehicles if not addressed promptly. I would appreciate it if the city could send someone to inspect and repair the issue as soon as possible.",web form,awaiting response,high,b3cdcf8f-3c7a-4001-b7fb-646e909d2fa9,40.69288457141688,-73.99519671857111
Unlicensed Cannabis Retailer in Brooklyn (unique_key: 67082562),"I am reporting an unlicensed cannabis retailer operating at 133 North 4 Street in Brooklyn, zip code 11249. As a concerned citizen, I am worried about the potential health and safety risks associated with unregulated cannabis sales in my community. The store appears to be openly selling cannabis products without any visible licenses or permits, and I believe it is essential for the authorities to investigate and take necessary actions to ensure compliance with the law. I would appreciate it if this matter could be looked into as soon as possible to maintain the well-being and safety of our neighborhood.",phone,awaiting response,low,b3cdcf8f-3c7a-4001-b7fb-646e909d2fa9,40.7163783369144,-73.95982507270826
Malfunctioning Traffic Signal Controller in Brooklyn (unique_key: 67075635),"I am writing to report a issue with the traffic signal controller at an intersection in Brooklyn. The controller appears to be malfunctioning, causing the traffic signal to cycle irregularly and potentially creating a hazardous situation for drivers and pedestrians. I have noticed this issue over the past few days and it seems to be persistent, so I wanted to bring it to the attention of the relevant authorities to ensure it gets addressed as soon as possible. I would appreciate it if someone could investigate and repair the controller to restore normal traffic signal operation.",web form,awaiting response,high,b3cdcf8f-3c7a-4001-b7fb-646e909d2fa9,40.57545160215122,-73.99538155017676
Construction Lead Dust in Common Areas at 240 West 73 Street (unique_key: 67080967),"I am writing to report concerns about lead dust in the common areas of my building, located at 240 West 73 Street in Manhattan. Recently, there has been construction activity in the building, and I am worried that it may be generating lead dust that is contaminating the shared spaces, posing a health risk to residents. As a resident, I am concerned about the potential health impacts of lead exposure, particularly for children and vulnerable populations. I would appreciate it if the city could investigate this matter and take steps to ensure that the construction is being done safely and in compliance with regulations.",web form,awaiting response,medium,b3cdcf8f-3c7a-4001-b7fb-646e909d2fa9,40.779875543029725,-73.98255271981678
Missed Trash Collection on Harway Avenue (unique_key: 67085396),"I am reporting a missed trash collection at my residence, located at 2526 Harway Avenue in Brooklyn. Despite having my trash placed at the curb on the designated collection day, it was not picked up. This has resulted in an accumulation of waste, and I am concerned about the potential for sanitation and health issues. I would appreciate it if the collection could be rescheduled as soon as possible to address this issue.",web form,awaiting response,medium,b3cdcf8f-3c7a-4001-b7fb-646e909d2fa9,40.59224134821681,-73.99172214667232
Graffiti at Commercial Location on Z Avenue in Brooklyn (unique_key: 67074099),"I am reporting graffiti at the commercial location of 1514 Z Avenue in Brooklyn. The building has been vandalized with unwanted tags and markings that are visible from the street. As a concerned citizen, I believe it is essential to address this issue promptly to maintain the aesthetic appeal and property value of the area. I would appreciate it if the city could send someone to remove the graffiti as soon as possible.",web form,awaiting response,low,b3cdcf8f-3c7a-4001-b7fb-646e909d2fa9,40.587999937320006,-73.95395083755787
"Illegal Dumping on Sidewalk at 938 Hart Street, Brooklyn (unique_key: 67075232)","I am reporting an incident of illegal dumping on the sidewalk outside 938 Hart Street in Brooklyn. There is a large amount of trash and debris that has been discarded on the sidewalk, creating an eyesore and a potential health hazard for pedestrians. I kindly request that the city sends a crew to remove the dumped materials as soon as possible to restore the cleanliness and safety of our neighborhood. This issue has been ongoing for a few days, and I would appreciate it if it could be addressed promptly.",phone,awaiting response,medium,b3cdcf8f-3c7a-4001-b7fb-646e909d2fa9,40.704050477222346,-73.92064601074313
"Dirty Water Complaint at 2764 Creston Avenue, Bronx (unique_key: 67075367)","I am writing to report a concern about the water quality at my residence, 2764 Creston Avenue in the Bronx. The water coming out of my taps is dirty and discolored, which is causing me distress as I am unsure if it is safe for consumption. I have noticed this issue for the past few days and it seems to be persistent, prompting me to reach out for assistance in resolving this matter. I would appreciate it if someone could investigate and take necessary actions to address the dirty water issue at my location.",web form,awaiting response,medium,b3cdcf8f-3c7a-4001-b7fb-646e909d2fa9,40.86958224000897,-73.89304183795436
Street Light Outage in the Bronx (unique_key: 67077141),"I am reporting a street light outage in my neighborhood in the Bronx. The light has been out for a few days, and it's causing concerns for safety and visibility, especially at night. I believe it's essential to have this light repaired as soon as possible to prevent any potential accidents or crimes. I would appreciate it if someone could look into this matter and schedule a repair at their earliest convenience.",web form,awaiting response,medium,b3cdcf8f-3c7a-4001-b7fb-646e909d2fa9,40.829627450466724,-73.90220480962611
Street Light Outage at Beach 130 Street in Queens (unique_key: 67074176),"I am reporting a street light outage at 568 Beach 130 Street in Queens. The light has been out for a few nights, and it's causing concerns for safety and visibility in the area. As a resident, I am worried that the darkness may attract crime or pose a risk to pedestrians, especially at night. I would appreciate it if someone could look into this matter and restore the street light as soon as possible.",web form,awaiting response,medium,b3cdcf8f-3c7a-4001-b7fb-646e909d2fa9,40.580711122434785,-73.85172269508973
Smoking in Smoke-Free Area at 312 West 34th Street (unique_key: 67082575),"I am writing to report that smoking or vaping is being allowed in a smoke-free area at 312 West 34th Street in Manhattan. As I walked by the commercial building, I noticed individuals smoking near the entrance, which is clearly marked as a smoke-free zone. This is not only a nuisance, but it also poses a health risk to those around them. I kindly request that the city takes action to address this issue and ensure compliance with smoke-free regulations.",web form,awaiting response,low,b3cdcf8f-3c7a-4001-b7fb-646e909d2fa9,40.75246498456307,-73.99413850914024
"Sewer Backup at 97 Atlantic Avenue, Staten Island (unique_key: 67075364)","I am writing to report a sewer backup at my residence, located at 97 Atlantic Avenue on Staten Island. This morning, I noticed that sewage is backing up into my basement, causing a mess and a strong odor. The backup appears to be coming from the sewer line, and I am concerned about the potential health risks and property damage. I would greatly appreciate it if someone could investigate and address this issue as soon as possible.",phone,awaiting response,medium,b3cdcf8f-3c7a-4001-b7fb-646e909d2fa9,40.593489505657395,-74.09522051581453
Excessive Helicopter Noise at 208 East 28 Street (unique_key: 67079502),I am writing to report a persistent and disturbing noise issue caused by helicopters flying low over my residence at 208 East 28 Street in Manhattan. The constant whirring and humming of the helicopters is not only disrupting my peace but also causing concern for the safety and well-being of the community. The noise is particularly bothersome during late evening and early morning hours when it is supposed to be quiet. I kindly request that the relevant authorities look into this matter and take necessary actions to mitigate the noise pollution.,web form,awaiting response,low,b3cdcf8f-3c7a-4001-b7fb-646e909d2fa9,40.74180836717385,-73.98049489472714
Excessive Helicopter Noise at 34 West 70 Street (unique_key: 67078101),I am writing to report a persistent noise disturbance caused by a helicopter hovering above my residence at 34 West 70 Street in Manhattan. The constant whirring and loud noise from the helicopter are disrupting my daily life and causing a disturbance in the neighborhood. I am concerned about the potential impact on the quality of life for residents in the area and would appreciate it if the city could look into regulating or mitigating this issue. The noise has been ongoing for several hours and is showing no signs of stopping.,web form,awaiting response,low,b3cdcf8f-3c7a-4001-b7fb-646e909d2fa9,40.77536241706911,-73.97800101948314
Illegal Dumping on St Nicholas Avenue (unique_key: 67082484),"I am reporting an instance of illegal dumping on St Nicholas Avenue in Manhattan. There is a large amount of trash and debris that has been discarded on the street, creating an eyesore and a potential health hazard. I kindly request that the city send a team to remove the dumped materials as soon as possible to restore the cleanliness and safety of our neighborhood. The exact location of the dumping is on the street at 22 St Nicholas Avenue, zip code 10026.",web form,awaiting response,medium,b3cdcf8f-3c7a-4001-b7fb-646e909d2fa9,40.7994726623649,-73.95242482596306
Illegal Dumping on Jamaica Avenue in Queens (unique_key: 67083910),"I am writing to report an instance of illegal dumping on Jamaica Avenue in Queens. There is a significant amount of trash and debris that has been discarded on the street at 95-04 Jamaica Avenue, and it is creating an eyesore and potentially attracting pests. I kindly request that the city arrange for the removal of this waste as soon as possible to maintain the cleanliness and safety of our community. The dumping is currently located on the street, and I would appreciate it if someone could investigate and take action to address this issue.",web form,awaiting response,medium,b3cdcf8f-3c7a-4001-b7fb-646e909d2fa9,40.69425578268603,-73.85031621409354
Excessive Helicopter Noise at 144 West 71 Street (unique_key: 67080900),"I am writing to report a persistent noise issue caused by helicopters flying over my residence at 144 West 71 Street in Manhattan. The constant hovering and loud noise from these helicopters are disrupting my daily life and causing a disturbance in the neighborhood. I understand that helicopter traffic is a part of city life, but the frequency and volume of the noise are excessive and I kindly request that the city looks into regulating or mitigating this issue. I would appreciate any assistance in resolving this matter and restoring some peace to our community.",web form,awaiting response,low,b3cdcf8f-3c7a-4001-b7fb-646e909d2fa9,40.77740227125625,-73.98088525025749
Chemical Odor Complaint in 3+ Family Apartment Building (unique_key: 67076559),"I am a resident of 85 East 10 Street in Manhattan and I am concerned about a strong chemical odor that has been persisting in my building. The smell is noticeable in the hallways and apartments, and I am worried that it may be affecting the health and well-being of the residents. I believe the odor may be related to a potential gas or vapor leak, and I would like someone to investigate and take necessary actions to resolve the issue. I would appreciate it if someone could look into this matter as soon as possible to ensure a safe and healthy living environment for everyone in the building.",web form,awaiting response,high,b3cdcf8f-3c7a-4001-b7fb-646e909d2fa9,40.73102817334543,-73.98975290710104
"Graffiti Removal Request at 2 Avenue C, Brooklyn (unique_key: 67082783)","I am writing to report an incident of graffiti at 2 Avenue C in Brooklyn. The building's wall has been vandalized with unwanted tags and symbols, which is not only an eyesore but also detracts from the overall aesthetic of the neighborhood. I am concerned that if left unchecked, the graffiti may spread and encourage further vandalism. I would greatly appreciate it if the city could send someone to remove the graffiti as soon as possible.",web form,awaiting response,low,b3cdcf8f-3c7a-4001-b7fb-646e909d2fa9,40.640213377636925,-73.97989402827112
Graffiti at 5802 3rd Avenue in Brooklyn (unique_key: 67077063),"I am writing to report an incident of graffiti at 5802 3rd Avenue in Brooklyn. The building has been vandalized with unwanted tags and markings that are visible from the street. As a concerned citizen, I believe it's essential to address this issue promptly to maintain the aesthetic and property value of our neighborhood. I would appreciate it if the city could send someone to remove the graffiti as soon as possible.",web form,awaiting response,low,b3cdcf8f-3c7a-4001-b7fb-646e909d2fa9,40.64307632406337,-74.01931769519454
Graffiti at 5121 2nd Avenue in Brooklyn (unique_key: 67076896),"I am writing to report an incident of graffiti at the mixed-use property located at 5121 2nd Avenue in Brooklyn. The graffiti is visible on the exterior of the building and appears to be recent. As a concerned citizen, I believe it is essential to address this issue promptly to maintain the cleanliness and aesthetic appeal of our neighborhood. I would appreciate it if the city could send someone to remove the graffiti as soon as possible.",web form,awaiting response,low,b3cdcf8f-3c7a-4001-b7fb-646e909d2fa9,40.64836304318461,-74.01767235284578
"Illegal Conversion of Residential Building at 1155 Dean Street, Brooklyn (unique_key: 67077050)","I am writing to report a suspected illegal conversion of a residential building at 1155 Dean Street in Brooklyn. The building appears to have been altered to accommodate multiple dwellings without proper permits or zoning approvals, posing a potential safety hazard to occupants and neighboring residents. I have noticed an unusual number of entrances and exits, as well as multiple mailboxes and utility meters, which suggests that the building is being used for unauthorized purposes. I am concerned about the potential risks to the community and request that the city investigate this matter further.",web form,awaiting response,medium,b3cdcf8f-3c7a-4001-b7fb-646e909d2fa9,40.6769656986303,-73.95136936861849
Graffiti at Commercial Location on 2nd Avenue in Brooklyn (unique_key: 67074100),"I am writing to report an incident of graffiti at the commercial location of 5201 2nd Avenue in Brooklyn. The graffiti is visible and appears to have been recently applied, detracting from the appearance of the building and the surrounding area. As a concerned citizen, I believe it is essential to address this issue promptly to maintain the aesthetic and property values in our neighborhood. I would appreciate it if the city could arrange for the removal of the graffiti as soon as possible.",web form,awaiting response,low,b3cdcf8f-3c7a-4001-b7fb-646e909d2fa9,40.64788537337797,-74.01816952796926
Graffiti at 531 52nd Street in Brooklyn (unique_key: 67077064),"I am writing to report an incident of graffiti at the location of 531 52nd Street in Brooklyn. The graffiti is visible and appears to be recent, and I am concerned that it may be an eyesore for the community and potentially damage the property. As a resident of the area, I would appreciate it if the city could send someone to remove the graffiti as soon as possible. I believe that prompt removal will help to maintain the cleanliness and beauty of our neighborhood.",web form,awaiting response,low,b3cdcf8f-3c7a-4001-b7fb-646e909d2fa9,40.64350838251565,-74.01067326680678
Graffiti at 580 52nd Street in Brooklyn (unique_key: 67081204),"I am reporting an incident of graffiti at the mixed-use property located at 580 52nd Street in Brooklyn. The graffiti is visible on the exterior of the building and appears to be recent. As a concerned citizen, I believe it is essential to address this issue promptly to maintain the aesthetic appeal and property values in our neighborhood. I would appreciate it if the city could arrange for the removal of the graffiti as soon as possible.",web form,awaiting response,low,b3cdcf8f-3c7a-4001-b7fb-646e909d2fa9,40.64301987977915,-74.00990206699713
Failed Street Repair at 842 58th Street in Brooklyn (unique_key: 67076676),"I am writing to report a failed street repair at 842 58th Street in Brooklyn. The recent repair work done on the street has not held up, and the road is once again in a state of disrepair with large potholes and uneven pavement. This is causing damage to vehicles and posing a hazard to pedestrians and cyclists. I kindly request that the city sends a crew to reassess and redo the repair work as soon as possible.",web form,awaiting response,high,b3cdcf8f-3c7a-4001-b7fb-646e909d2fa9,40.63602909844587,-74.00738974229661
"Graffiti Removal Request at 5204 7 Avenue, Brooklyn (unique_key: 67075545)","I am writing to report an incident of graffiti at my residential building located at 5204 7 Avenue in Brooklyn. The graffiti is visible on the exterior of the building and is an eyesore for the community. I am concerned that if it is not removed promptly, it may attract more vandalism and decrease the property value of our homes. I would greatly appreciate it if the city could send someone to remove the graffiti as soon as possible.",web form,awaiting response,low,b3cdcf8f-3c7a-4001-b7fb-646e909d2fa9,40.64123048116164,-74.00719213816828
"Water Leak at 39 Jerome Street, Brooklyn (unique_key: 67079747)","I am writing to report a water leak at 39 Jerome Street in Brooklyn. The leak appears to be coming from the water main or a nearby pipe, and it's causing water to accumulate on the sidewalk and street. I'm concerned that if this issue isn't addressed, it could lead to further damage or create a hazardous condition for pedestrians and drivers. I would appreciate it if someone could investigate and repair the leak as soon as possible.",phone,awaiting response,medium,b3cdcf8f-3c7a-4001-b7fb-646e909d2fa9,40.681220514329596,-73.88875422981869
Unauthorized Construction at Occupied Multiple Dwelling (unique_key: 67085415),"I am reporting unauthorized construction work being done at 1155 Dean Street in Brooklyn, which appears to be an occupied multiple dwelling. The work is being done without any visible permits posted, and I am concerned about the safety and potential hazards this may pose to the residents. As a nearby resident, I have noticed the ongoing construction for several days and would like the city to investigate and take necessary action to ensure compliance with building codes and regulations. I would appreciate it if someone could look into this matter as soon as possible.",web form,awaiting response,low,b3cdcf8f-3c7a-4001-b7fb-646e909d2fa9,40.6769656986303,-73.95136936861849
Street Light Outage on 61 Street in Queens (unique_key: 67077134),"I am writing to report a street light outage at 55-56 61 Street in the Queens borough, zip code 11378. The light has been out for a few nights, and it's causing concerns for safety and visibility in the area, especially at night. I would appreciate it if someone could look into this issue and arrange for the necessary repairs to be made as soon as possible. This will help to restore adequate lighting to the street and improve overall safety for residents and pedestrians.",web form,awaiting response,medium,b3cdcf8f-3c7a-4001-b7fb-646e909d2fa9,40.725384035848705,-73.90426271790766
Excessive Construction Noise at 1320 Newkirk Avenue (unique_key: 67081159),"I am writing to report excessive construction noise at 1320 Newkirk Avenue in Brooklyn, which is occurring outside of the permitted hours. The constant noise is disrupting my daily activities and causing a disturbance in the neighborhood. I understand that construction is necessary, but I believe it's essential to enforce the noise regulations to maintain a reasonable quality of life for residents. I would appreciate it if the city could look into this matter and take necessary actions to address the issue.",web form,awaiting response,low,b3cdcf8f-3c7a-4001-b7fb-646e909d2fa9,40.634799780401,-73.96482460903492
Leaking Fire Hydrant on 72 Street (unique_key: 67075375),"I am reporting a continuously running fire hydrant located at 600 72 Street in Brooklyn. The hydrant has been leaking for some time, and I am concerned about the waste of water and potential damage to the surrounding area. I would appreciate it if someone could investigate and repair the hydrant as soon as possible to prevent further water loss. The constant flow of water is also causing a puddle that may become a slipping hazard for pedestrians.",text,awaiting response,medium,b3cdcf8f-3c7a-4001-b7fb-646e909d2fa9,40.6302362212657,-74.0192527329564
Rodent Infestation at 183-20 Horace Harding Expressway (unique_key: 67082563),"I am writing to report a condition attracting rodents at 183-20 Horace Harding Expressway, a 3+ family mixed-use building in Queens. The area surrounding the building has a significant amount of trash and debris, which I believe is contributing to the rodent infestation. I have seen rodents scurrying around the property and am concerned about the potential health risks to the residents and nearby businesses. I kindly request that the city take immediate action to address this issue and work with the property owner to rectify the situation.",phone,awaiting response,medium,b3cdcf8f-3c7a-4001-b7fb-646e909d2fa9,40.73945431675565,-73.7907522405034
Unsecured Trash and Recycling on Grand Avenue Sidewalk (unique_key: 67081052),"I am reporting a residential disposal issue at 2471 Grand Avenue in the Bronx, where trash and recycling are not being properly secured. The unsecured waste is spilling onto the sidewalk, creating an eyesore and potentially attracting pests. As a concerned citizen, I am worried about the impact this is having on the cleanliness and safety of our neighborhood. I kindly request that the responsible party be notified to properly secure their trash and recycling.",web form,awaiting response,medium,b3cdcf8f-3c7a-4001-b7fb-646e909d2fa9,40.863481152365964,-73.9027732459544
Illegal Tree Damage on Stuart Street in Brooklyn (unique_key: 67078037),"I am writing to report that the roots of a tree on Stuart Street in Brooklyn have been damaged, and I am concerned about the potential harm this could cause to the tree and surrounding area. The damage appears to be intentional and I believe it may be a result of recent construction or excavation work in the area. I would appreciate it if someone could investigate this matter and take necessary actions to protect the tree and prevent further damage. The affected tree is located on the street outside 1762 Stuart Street.",text,awaiting response,medium,b3cdcf8f-3c7a-4001-b7fb-646e909d2fa9,40.60931346049855,-73.94216986040813
Spoiled Food at Restaurant on 7th Avenue (unique_key: 67085202),"I am writing to report a concern about the food quality at a restaurant located at 2335 7th Avenue in Manhattan. During my recent visit, I noticed that some of the food items on display appeared to be spoiled, which raises serious health concerns. The spoiled food was visible in the display case, and I am worried that it may pose a risk to the health and safety of the restaurant's customers. I kindly request that the relevant authorities investigate this matter and take necessary actions to ensure the restaurant is maintaining proper food handling and storage practices.",phone,awaiting response,medium,b3cdcf8f-3c7a-4001-b7fb-646e909d2fa9,40.81640602274112,-73.94288587044198
Water Leak at 40 Bruckner Boulevard (unique_key: 67079748),"I am reporting a water leak at 40 Bruckner Boulevard in the Bronx. The leak appears to be coming from a underground pipe and is causing water to seep up through the sidewalk, creating a hazardous condition for pedestrians. I am concerned that if this issue is not addressed, it may lead to further damage and potential flooding in the area. I would appreciate it if someone could investigate and repair the leak as soon as possible.",web form,awaiting response,medium,b3cdcf8f-3c7a-4001-b7fb-646e909d2fa9,40.80668082306801,-73.92713042937037
Chemical Odor Complaint in 3+ Family Apartment Building (unique_key: 67078038),"I am a concerned resident of 1122 East 222 Street in the Bronx, and I am writing to report a strong chemical odor in my apartment building. The smell is persistent and seems to be coming from within the building, causing discomfort and health concerns for me and my neighbors. I believe it may be related to a possible leak or improper use of chemicals in the building, and I would appreciate it if someone could investigate and take necessary actions to resolve the issue. I am worried about the potential health risks associated with long-term exposure to these fumes.",phone,awaiting response,high,b3cdcf8f-3c7a-4001-b7fb-646e909d2fa9,40.88183024163845,-73.84976010638455
