ticket_subject,ticket_body,origin,status,priority,reporter_id,lat,lng
Improper Vent/Exhaust Installation at 301 East 90 Street (unique_key: 67075544),"I am writing to report an illegal and improper vent/exhaust installation at 301 East 90 Street in Manhattan. The vent appears to be discharging directly onto the sidewalk, creating a nuisance and potentially violating building codes. As a nearby resident, I am concerned about the potential health and safety implications of this improper installation. I would appreciate it if the city could investigate and take necessary action to correct this issue.",web form,awaiting response,medium,b3cdcf8f-3c7a-4001-b7fb-646e909d2fa9,40.780293986553495,-73.94952100131523
"Dirty Water Complaint at 418 Billiou Street, Staten Island (unique_key: 67073936)","I am writing to report a concern about the water quality at my residence, 418 Billiou Street, in the Staten Island borough. The water coming out of my faucets is dirty and discolored, which is causing me distress as I am unsure if it is safe for consumption or use. I have noticed this issue for the past few days and it seems to be persistent, so I would appreciate it if someone could investigate and resolve this matter as soon as possible. I would like to request that the water system be checked to determine the cause of the dirty water and have it corrected to ensure safe and clean water supply.",web form,awaiting response,medium,b3cdcf8f-3c7a-4001-b7fb-646e909d2fa9,40.5299882697785,-74.19187899127837
Non-Food Vendor Operating Without Permit on Prince Street (unique_key: 67075280),"I am reporting a non-food vendor operating on the street at 85 Prince Street in Manhattan. The vendor appears to be selling merchandise without a valid permit, and I am concerned that they may be obstructing the sidewalk or creating a disturbance. I have seen this vendor operating in the area for several days, and I believe it is essential to address this issue to maintain the safety and cleanliness of our neighborhood. I would appreciate it if the city could send someone to investigate and take appropriate action.",web form,awaiting response,medium,b3cdcf8f-3c7a-4001-b7fb-646e909d2fa9,40.724413751445105,-73.99812395794528
Missed Compost Collection on President Street (unique_key: 67076779),"I am reporting a missed compost collection at my residence, located at 1172 President Street in Brooklyn. My compost was placed at the curb on the designated collection day, but it was not picked up. I am concerned that this missed collection may attract pests and create an unpleasant odor in my neighborhood. I would appreciate it if the compost could be collected as soon as possible to maintain the cleanliness and sanitation of our community.",phone,awaiting response,medium,b3cdcf8f-3c7a-4001-b7fb-646e909d2fa9,40.668124942930035,-73.95176872985618
Elevator Issue at 180 Riverside Boulevard (unique_key: 67080806),"I am writing to report a problem with the elevators at 180 Riverside Boulevard in Manhattan. There are multiple elevators on the property, but unfortunately, they are not functioning properly, causing inconvenience to residents and visitors. The issue has been ongoing for some time, and I am concerned about the safety and accessibility of the building. I would appreciate it if someone could investigate and address this matter as soon as possible.",web form,awaiting response,medium,b3cdcf8f-3c7a-4001-b7fb-646e909d2fa9,40.77839687772028,-73.98850353760236
Street Light Outage on Staten Island (unique_key: 67078605),"I am reporting a street light outage on Staten Island that is causing concerns for safety and visibility in the area. The light has been out for a few days, and I am worried that it may lead to accidents or crime. I would greatly appreciate it if the city could send someone to repair or replace the light as soon as possible. The exact location is not specified, but I can provide more details if needed to help identify the faulty street light.",web form,awaiting response,medium,b3cdcf8f-3c7a-4001-b7fb-646e909d2fa9,40.61748921405342,-74.12219048390101
Request for Lead Kit at Residential Address (unique_key: 67082586),"I am a concerned homeowner residing at 1816 Glenwood Road in Brooklyn, and I am writing to request a lead kit for my residential property. I am worried about the potential presence of lead in my home, which could pose a risk to my family's health. I would greatly appreciate it if a lead kit could be provided to me as soon as possible, so I can take the necessary steps to ensure a safe living environment. I can be reached at my address if any additional information is needed to process my request.",web form,awaiting response,medium,b3cdcf8f-3c7a-4001-b7fb-646e909d2fa9,40.632681847530975,-73.95964487826485
Defective Street Hardware on 4 Avenue in Brooklyn (unique_key: 67080951),"I am writing to report a defective hardware issue on 4 Avenue in Brooklyn. Specifically, there is a broken metal plate or grate on the street that is causing a hazardous condition for drivers and pedestrians. The plate appears to be loose and is making a loud noise when vehicles drive over it, and I am concerned that it could lead to an accident if not repaired. I would appreciate it if the city could send someone to inspect and repair the defective hardware as soon as possible.",web form,awaiting response,high,b3cdcf8f-3c7a-4001-b7fb-646e909d2fa9,40.63461610971135,-74.02351985217783
Obstruction on Willoughby Avenue (unique_key: 67079654),"I am reporting a cone obstructing the street at 1344 Willoughby Avenue in Brooklyn. The cone is currently blocking a portion of the roadway, causing inconvenience to drivers and pedestrians. I am concerned that this obstruction may pose a safety hazard, especially at night or during heavy traffic. I would appreciate it if the city could remove or relocate the cone as soon as possible.",phone,awaiting response,low,b3cdcf8f-3c7a-4001-b7fb-646e909d2fa9,40.706232685815245,-73.92082014577792
Obstruction on Sidewalk by Sign at 202 Avenue of the Americas (unique_key: 67076763),"I am writing to report a sign that is obstructing the sidewalk at 202 Avenue of the Americas in Manhattan. The sign is currently blocking a significant portion of the walkway, making it difficult for pedestrians to pass through. This obstruction poses a safety hazard, particularly for individuals with disabilities or those with strollers. I kindly request that the city take immediate action to remove or reposition the sign to ensure a clear and safe path for all pedestrians.",web form,awaiting response,medium,b3cdcf8f-3c7a-4001-b7fb-646e909d2fa9,40.726787928274874,-74.00350327256554
Request for Lead Kit at Residential Address (unique_key: 67076847),"I am concerned about the potential presence of lead in my home and would like to request a lead kit to test for lead contamination. I reside at 25 Perry Street in Manhattan, 10014, and am worried about the health risks associated with lead exposure, particularly for my family. I would greatly appreciate it if a lead kit could be provided to me as soon as possible so I can take the necessary steps to ensure a safe living environment. Please let me know what steps I need to take to receive the lead kit and any additional information required to facilitate the request.",web form,awaiting response,medium,b3cdcf8f-3c7a-4001-b7fb-646e909d2fa9,40.73568645298539,-74.00235266606946
Illegal Dumping on Sidewalk at 7518 3rd Avenue in Brooklyn (unique_key: 67076751),"I am reporting an incident of illegal dumping on the sidewalk in front of 7518 3rd Avenue in Brooklyn. There is a large amount of debris and trash that has been discarded on the sidewalk, creating an eyesore and a potential hazard for pedestrians. I kindly request that the city sends someone to remove this trash as soon as possible to maintain the cleanliness and safety of our neighborhood. The dumping is currently located on the sidewalk, obstructing pedestrian traffic and causing concern among local residents.",text,awaiting response,medium,b3cdcf8f-3c7a-4001-b7fb-646e909d2fa9,40.63126923796805,-74.0278815883191
Unlicensed Cannabis Retailer in Brooklyn (unique_key: 67078317),"I am writing to report an unlicensed cannabis retailer operating at 466 Fulton Street in Brooklyn. The store appears to be selling cannabis products without any visible licenses or permits, which is a concern for the community. As a resident, I am worried about the potential impact on local businesses and public health. I would appreciate it if the city could investigate and take necessary actions to ensure compliance with cannabis regulations.",web form,awaiting response,low,b3cdcf8f-3c7a-4001-b7fb-646e909d2fa9,40.690325507955414,-73.98453777749506
Multiple Elevators Out of Order at 175 West 87th Street (unique_key: 67083684),"I am writing to report that multiple elevators are out of order at 175 West 87th Street in Manhattan. As a resident of the building, I am concerned about the inconvenience and potential safety risks this poses, especially for seniors and individuals with disabilities. The elevators have been malfunctioning for some time, and I kindly request that the necessary repairs be made as soon as possible to restore full functionality. I would appreciate it if someone could look into this matter and provide a timeline for when the elevators can be expected to be back in working order.",web form,awaiting response,medium,b3cdcf8f-3c7a-4001-b7fb-646e909d2fa9,40.78798178518925,-73.97360560880402
Dead Raccoon on Sidewalk on Barry Street (unique_key: 67081089),"I am reporting a dead raccoon on the sidewalk of Barry Street in Staten Island. The animal is located on the public sidewalk and is starting to decompose, causing a potential health hazard and unpleasant odor for nearby residents. I am concerned about the safety and well-being of the community, especially for children and pets who may be walking by. I kindly request that the city sends someone to remove the dead animal as soon as possible.",phone,awaiting response,medium,b3cdcf8f-3c7a-4001-b7fb-646e909d2fa9,40.551901100157124,-74.21460866858351
Defective Sidewalk Hardware at 1 Times Square (unique_key: 67080945),"I am writing to report a hazardous condition on the sidewalk at 1 Times Square in Manhattan. The hardware embedded in the sidewalk, possibly a utility cover or grate, is defective and poses a tripping hazard to pedestrians. As this location is heavily trafficked, I am concerned about the potential for accidents and injuries. I kindly request that the necessary repairs be made to ensure the safety of the public.",web form,awaiting response,high,b3cdcf8f-3c7a-4001-b7fb-646e909d2fa9,40.75662809704763,-73.98628744115045
"Excessive Barking Dog Noise at 525 Chester Street, Brooklyn (unique_key: 67073914)","I am writing to report a noise complaint regarding a barking dog at 525 Chester Street in Brooklyn. The constant barking has been disrupting my peace and quiet, and I believe it's necessary to address this issue as soon as possible. The noise has been ongoing for several hours, and I am concerned that it may be a disturbance to other neighbors as well. I would appreciate it if someone could look into this matter and take the necessary steps to resolve it.",web form,awaiting response,low,b3cdcf8f-3c7a-4001-b7fb-646e909d2fa9,40.65859103589291,-73.90886384475496
Construction Lead Dust in Common Areas of 3+ Family Apartment Building (unique_key: 67078164),"I am concerned about the presence of lead dust in the common areas of my apartment building, located at 1175 Morris Avenue in the Bronx. The ongoing construction in the building has stirred up lead dust, which is a hazard to the health and safety of residents, especially children and pregnant women. I request that the city take immediate action to inspect the premises and ensure that the construction is being done in a safe and lead-free manner. I would appreciate it if someone could look into this matter as soon as possible to protect the well-being of my neighbors and me.",web form,awaiting response,medium,b3cdcf8f-3c7a-4001-b7fb-646e909d2fa9,40.83254938306124,-73.9145266364985
Defective Street Hardware at Times Square (unique_key: 67078156),"I am writing to report a defective street hardware issue at 1 Times Square in Manhattan. The hardware in question appears to be a broken or malfunctioning manhole cover or street plate, which is causing a hazardous uneven surface for both vehicular and pedestrian traffic. As this is a highly trafficked area, I am concerned about the potential for accidents or injuries. I kindly request that the necessary repairs be made as soon as possible to ensure public safety.",web form,awaiting response,high,b3cdcf8f-3c7a-4001-b7fb-646e909d2fa9,40.75662809704763,-73.98628744115045
Water Hydrant Leaking at East Figurea Avenue (unique_key: 67076885),"I am reporting a constantly running fire hydrant located at 11 East Figurea Avenue on Staten Island. The hydrant is currently discharging a large amount of water, causing unnecessary waste and potentially creating a hazardous condition on the road. I am concerned about the impact this may have on our water resources and the surrounding environment. I would appreciate it if someone could investigate and repair the issue as soon as possible.",web form,awaiting response,medium,b3cdcf8f-3c7a-4001-b7fb-646e909d2fa9,40.55259995621142,-74.15769697217203
Possible Water Main Break on 69 Place in Queens (unique_key: 67075378),"I am reporting a possible water main break on 69 Place between 60-76, Queens, NY 11378. There is a significant amount of water flowing from the ground and onto the street, causing flooding and potentially hazardous conditions for pedestrians and drivers. I am concerned that this may be a water main break and would like the city to investigate and repair the issue as soon as possible to prevent further damage and disruption to the community. The water is currently flowing steadily and shows no signs of stopping, prompting me to bring this to the city's attention.",phone,awaiting response,high,b3cdcf8f-3c7a-4001-b7fb-646e909d2fa9,40.720504790468894,-73.88995491262327
Malfunctioning Traffic Signal Controller in Brooklyn (unique_key: 67079981),"I am writing to report a problem with the traffic signal controller at an intersection in Brooklyn. The controller appears to be malfunctioning, causing the traffic signal to cycle irregularly and pose a hazard to drivers and pedestrians. I have noticed this issue over the past few days and it seems to be getting worse, so I wanted to bring it to the attention of the relevant authorities to ensure it gets fixed as soon as possible. I would appreciate it if someone could investigate and repair the controller to restore normal traffic flow.",web form,awaiting response,high,b3cdcf8f-3c7a-4001-b7fb-646e909d2fa9,40.62384939842456,-73.9313070231195
Excessive Construction Noise at 214 East 85 Street (unique_key: 67079716),"I am writing to report excessive construction noise at 214 East 85 Street in Manhattan. The noise is occurring outside of regular construction hours, causing a significant disturbance to nearby residents. The constant banging and drilling is making it difficult for me to rest and enjoy my home. I kindly request that the city address this issue and ensure that construction activities are limited to authorized hours to minimize the disruption to our community.",web form,awaiting response,low,b3cdcf8f-3c7a-4001-b7fb-646e909d2fa9,40.77789418846198,-73.95392783947287
Malfunctioning Accessible Pedestrian Signal in Manhattan (unique_key: 67082256),"I am writing to report an issue with an Accessible Pedestrian Signal (APS) in Manhattan. The signal appears to be malfunctioning, as the audible cues and vibrating signals are not functioning properly, which may cause difficulties for visually impaired pedestrians. I am concerned about the safety of these individuals and would appreciate it if this issue could be addressed as soon as possible. The exact location of the malfunctioning APS is not specified, but I hope that a thorough inspection of Manhattan's traffic signals can help identify and resolve the problem.",web form,awaiting response,high,b3cdcf8f-3c7a-4001-b7fb-646e909d2fa9,40.73539003074569,-73.99827520034003
Missed Bulky Trash Collection on 60 Street in Brooklyn (unique_key: 67081031),"I am reporting a missed bulky trash collection at my address, 514 60 Street in Brooklyn. The trash was placed on the curb on the scheduled collection day, but it was not picked up. I am concerned that the missed collection will attract pests and create an eyesore in the neighborhood. I would appreciate it if the city could send a crew to collect the bulky trash as soon as possible.",web form,awaiting response,medium,b3cdcf8f-3c7a-4001-b7fb-646e909d2fa9,40.63914360745645,-74.01562331460408
Broken Glass at Bus Stop Shelter on Emmons Avenue (unique_key: 67078023),"I am writing to report a hazardous condition at the bus stop shelter located at 3003 Emmons Avenue in Brooklyn. The glass panel at the shelter is broken, posing a risk to commuters who use this stop. I am concerned that someone may get injured from the sharp edges, and I kindly request that the city sends someone to clean up the broken glass and repair or replace the damaged panel as soon as possible. This will help ensure the safety of bus riders in our community.",web form,awaiting response,high,b3cdcf8f-3c7a-4001-b7fb-646e909d2fa9,40.583916676617505,-73.9385016632354
Missed Compost Collection on East 100 Street (unique_key: 67078265),"I am reporting a missed compost collection at my residence, located at 1024 East 100 Street in Brooklyn. My compost was placed at the curb on the designated collection day, but it was not picked up. I am concerned that this missed collection will attract pests and create an unsanitary condition, and I would appreciate it if the compost could be collected as soon as possible. I would like to request that the collection be rescheduled to ensure that my compost is properly disposed of.",web form,awaiting response,medium,b3cdcf8f-3c7a-4001-b7fb-646e909d2fa9,40.642986927755246,-73.8959166191214
Street Light Outage on Avenue T in Brooklyn (unique_key: 67082866),"I am writing to report a street light outage at 5312 Avenue T in Brooklyn. The light has been out for a few days, and it's causing concerns for safety and visibility in the area, especially at night. I am worried that the darkness may attract crime or pose a hazard to pedestrians and drivers. I would appreciate it if the city could send someone to repair or replace the street light as soon as possible.",web form,awaiting response,medium,b3cdcf8f-3c7a-4001-b7fb-646e909d2fa9,40.612562795975556,-73.92264567264428
Traffic Signal Issue with Audible Pedestrian Signal in Brooklyn (unique_key: 67075276),"I am writing to report an issue with the traffic signal's Audible Pedestrian Signal (APS) in Brooklyn. The APS is not functioning properly, which is causing concerns for visually impaired pedestrians who rely on this feature to cross the street safely. I have noticed this issue over the past few days and believe it needs to be addressed as soon as possible to ensure the safety of all pedestrians. I would appreciate it if someone could look into this matter and repair the APS promptly.",web form,awaiting response,high,b3cdcf8f-3c7a-4001-b7fb-646e909d2fa9,40.66989187587576,-73.93379740051782
Encampment at 2025 Broadway in Manhattan (unique_key: 67076717),"I am writing to report a concerning encampment at the residential building located at 2025 Broadway in Manhattan. The presence of this encampment is causing unease among the residents and potentially creating an unsanitary environment. I have noticed a significant amount of debris and belongings scattered around the area, and I am worried about the safety and well-being of both the individuals residing in the encampment and the surrounding community. I kindly request that the city takes immediate action to address this issue and provide necessary support to those in need.",text,awaiting response,medium,b3cdcf8f-3c7a-4001-b7fb-646e909d2fa9,40.77662571123505,-73.98213474146851
"Chronic Illegal Dumping on Sidewalk at 2025 Broadway, Manhattan (unique_key: 67079661)","I am writing to report a persistent issue of illegal dumping on the sidewalk in front of 2025 Broadway in Manhattan. For weeks, I have noticed a steady accumulation of trash and debris, including furniture and household items, which is not only an eyesore but also a health hazard. The dumping seems to be ongoing, with new items appearing daily, and I am concerned about the impact this is having on our community's quality of life. I kindly request that the city takes immediate action to address this issue and prevent further dumping in the area.",text,awaiting response,medium,b3cdcf8f-3c7a-4001-b7fb-646e909d2fa9,40.77662571123505,-73.98213474146851
"Non-Residential Heat Complaint at 504 Broadway, Manhattan (unique_key: 67080846)","I am reporting a heating issue at the non-residential building located at 504 Broadway in Manhattan. The building has inadequate heat, and I am concerned about the welfare of the occupants and staff. As the weather is getting colder, it is essential that the heat is restored to a comfortable and safe level. I would appreciate it if someone could investigate and address this issue as soon as possible.",web form,awaiting response,medium,b3cdcf8f-3c7a-4001-b7fb-646e909d2fa9,40.72231677013743,-73.99939752083614
Malfunctioning Traffic Signal with Audible Pedestrian Signal in Manhattan (unique_key: 67080804),"I am writing to report a traffic signal issue in Manhattan that is causing concern for pedestrians. The Audible Pedestrian Signal (APS) is not functioning properly, which can be a hazard for visually impaired individuals. The signal appears to be working normally for vehicular traffic, but the audible cues for pedestrians are either not sounding or are sounding inconsistently. I believe this issue needs to be addressed as soon as possible to ensure pedestrian safety.",web form,awaiting response,high,b3cdcf8f-3c7a-4001-b7fb-646e909d2fa9,40.73413843314107,-73.9991845242651
Culvert Blockage on Palisade Avenue (unique_key: 67076868),"I am reporting a blocked culvert on Palisade Avenue that is in need of cleaning. The culvert is located near 4600 Palisade Avenue in the Bronx and appears to be clogged with debris, which may cause flooding and other issues if not addressed. I am concerned that if this blockage is not cleared, it could lead to problems for nearby residents and businesses. I would appreciate it if someone could investigate and clean the culvert as soon as possible.",phone,awaiting response,high,b3cdcf8f-3c7a-4001-b7fb-646e909d2fa9,40.8937958315522,-73.91621296309062
Faulty Flood Light on Manhattan Street (unique_key: 67079974),"I am writing to report a issue with a flood light on a street in Manhattan. The light appears to be malfunctioning, as it is constantly cycling on and off, which is causing a disturbance and potentially creating a safety hazard. I've noticed this problem for the past few nights and I'm concerned that it may be wasting energy and affecting the overall ambiance of the area. I would appreciate it if someone could investigate and repair or replace the light as soon as possible.",web form,awaiting response,medium,b3cdcf8f-3c7a-4001-b7fb-646e909d2fa9,40.77804197281066,-73.981989934345
"Missed Recycling Collection at 1330 Bergen Street, Brooklyn (unique_key: 67085389)","I am reporting a missed recycling collection for paper at my residence, located at 1330 Bergen Street in Brooklyn. The recycling was supposed to be collected on the scheduled day, but it was not picked up. I have ensured that the recycling was properly sorted and placed at the curb in accordance with the city's guidelines. I would appreciate it if the collection could be rescheduled as soon as possible to help keep our community clean.",web form,awaiting response,medium,b3cdcf8f-3c7a-4001-b7fb-646e909d2fa9,40.67557172048107,-73.94047207189888
Clogged Catch Basin Causing Flooding on 54th Avenue (unique_key: 67076866),"I am reporting a clogged catch basin located at 217-12 54th Avenue in Queens, which is causing flooding on the street and sidewalk. The catch basin is completely blocked, and as a result, water is accumulating and overflowing onto the surrounding area. This issue is not only a nuisance, but it also poses a risk to pedestrians and drivers, and I am concerned that it may lead to more severe problems if not addressed promptly. I would appreciate it if someone could investigate and clear the catch basin as soon as possible.",phone,awaiting response,high,b3cdcf8f-3c7a-4001-b7fb-646e909d2fa9,40.75254127959339,-73.76242859240348
Abandoned Bicycle on Dupont Street (unique_key: 67082467),"I am reporting an abandoned bicycle that has been chained to a public property on Dupont Street in Brooklyn. The bike appears to have been left unattended for an extended period, and I am concerned it may be taking up valuable space and becoming an eyesore. It is currently located at 111A Dupont Street, and I believe it should be removed to maintain the cleanliness and safety of our neighborhood. I would appreciate it if the city could send someone to collect the bike as soon as possible.",web form,awaiting response,medium,b3cdcf8f-3c7a-4001-b7fb-646e909d2fa9,40.73580430898299,-73.95594516555998
