ticket_subject,ticket_body,origin,status,priority,reporter_id,lat,lng
Obstruction on 32 Street in Queens (unique_key: 67078272),"I am reporting a cone obstruction on 32 Street in the Queens borough. The cone is currently blocking a portion of the street, potentially causing a hazard for drivers and pedestrians. I am concerned that if this issue is not addressed, it may lead to accidents or disruptions in traffic flow. I would appreciate it if the city could remove or relocate the cone as soon as possible to ensure public safety.",phone,awaiting response,low,b3cdcf8f-3c7a-4001-b7fb-646e909d2fa9,40.761599665302725,-73.92458792215176
Damaged Guard Rail on Arthur Kill Road (unique_key: 67080953),"I am reporting a damaged guard rail on Arthur Kill Road, which poses a safety hazard to drivers and pedestrians. The guard rail appears to be bent and loose, and I am concerned that it could cause an accident if not repaired. I have noticed this issue while driving on Arthur Kill Road near the 3044 address, and I hope it can be addressed as soon as possible. I would appreciate it if the relevant authorities could inspect and repair the guard rail to ensure public safety.",phone,awaiting response,high,b3cdcf8f-3c7a-4001-b7fb-646e909d2fa9,40.54491883453047,-74.23128859672183
Unleashed Dog in Public Area (unique_key: 67076566),"I am reporting an unleashed dog roaming freely in the public area near 88-10 86 Street in Queens. As I was walking by, I saw the dog without a leash or an owner in sight, which is a concern for public safety. The dog appears to be a medium-sized breed and is currently wandering around the unfenced area, posing a potential threat to pedestrians and other animals. I kindly request that animal control be dispatched to the location to safely capture the dog and reunite it with its owner.",web form,awaiting response,medium,b3cdcf8f-3c7a-4001-b7fb-646e909d2fa9,40.69055113111359,-73.85742463826716
"Outdoor Dining Concern at 214 Greene Avenue, Brooklyn (unique_key: 67076839)","I am writing to express concern about the outdoor dining setup at the restaurant located at 214 Greene Avenue in Brooklyn. The current configuration appears to be obstructing pedestrian traffic and taking up a significant portion of the sidewalk, making it difficult for people to walk by. I am worried about the safety and accessibility of the area, especially for individuals with disabilities or families with strollers. I would appreciate it if the city could look into this matter and ensure that the outdoor dining area is compliant with city regulations.",web form,awaiting response,low,b3cdcf8f-3c7a-4001-b7fb-646e909d2fa9,40.68705425247828,-73.96278503418345
"Outdoor Dining Concern at 214 Greene Avenue, Brooklyn (unique_key: 67075310)","I am writing to express concern about the outdoor dining setup at the restaurant located at 214 Greene Avenue in Brooklyn. The current configuration appears to be obstructing pedestrian traffic and taking up a significant portion of the sidewalk, making it difficult for people to walk by. As a frequent visitor to this area, I am worried about the safety and accessibility of the sidewalk, especially for individuals with disabilities or families with strollers. I would appreciate it if the city could look into this matter and ensure that the outdoor dining area is set up in a way that complies with city regulations and allows for safe passage.",web form,awaiting response,low,b3cdcf8f-3c7a-4001-b7fb-646e909d2fa9,40.68705425247828,-73.96278503418345
"Failed Street Repair at 35-37 204 Street, Queens (unique_key: 67080952)","I am writing to report a failed street repair at 35-37 204 Street in Queens. The street was recently resurfaced, but the repair work has already started to deteriorate, with potholes and uneven pavement forming. This is not only causing damage to vehicles, but it's also creating a hazardous condition for pedestrians and cyclists. I kindly request that the city sends a crew to reassess and redo the repair work to ensure the street is safe for everyone.",web form,awaiting response,high,b3cdcf8f-3c7a-4001-b7fb-646e909d2fa9,40.76589722417967,-73.78329747884915
"Sidewalk Blocked by Construction at 834 Pacific Street, Brooklyn (unique_key: 67078147)","I am writing to report that the sidewalk at 834 Pacific Street in Brooklyn is currently blocked due to ongoing construction. The obstruction is causing pedestrians to walk into the street, which is a significant safety concern, especially for children and seniors. I am concerned that if this issue is not addressed promptly, it may lead to accidents or injuries. I would appreciate it if the city could take immediate action to ensure the sidewalk is cleared and made safe for pedestrians.",phone,awaiting response,high,b3cdcf8f-3c7a-4001-b7fb-646e909d2fa9,40.68076171575791,-73.96679055295567
Poor Ventilation Causing Indoor Air Quality Issues at 411 Butler Street (unique_key: 67078043),"I am concerned about the indoor air quality at my residence, 411 Butler Street, due to inadequate ventilation. The lack of proper airflow is causing stale air and moisture buildup, which is exacerbating allergy issues and creating an unpleasant living environment. I have tried to improve the situation by opening windows, but it's not sufficient, and I believe a more permanent solution is needed to ensure healthy air circulation. I would appreciate it if someone could investigate and assist in resolving this issue.",phone,awaiting response,medium,b3cdcf8f-3c7a-4001-b7fb-646e909d2fa9,40.679675192230306,-73.98056714793253
Rodent Sighting at Commercial Building in Queens (unique_key: 67085448),"I am writing to report a rat sighting at the commercial building located at 155-01 90 Avenue in Queens. I witnessed a rat scurrying around the premises, specifically near the entrance of the building, and I am concerned about the potential health risks this poses to the employees and customers who frequent this location. The rat was seen during daylight hours, which suggests that the infestation may be significant. I kindly request that the necessary measures be taken to address this issue and prevent further rodent activity.",web form,awaiting response,medium,b3cdcf8f-3c7a-4001-b7fb-646e909d2fa9,40.7045939044023,-73.8021037797246
Unverified Food Establishment Permit at 10 Columbus Circle (unique_key: 67083725),"I am concerned that the restaurant located at 10 Columbus Circle in Manhattan may not have a valid permit or license to operate. As a frequent customer, I noticed that the establishment's certificate of permit is not displayed prominently as required by law. I am worried about the potential health and safety implications of this oversight and would like the city to verify the status of their permit. I would appreciate it if someone could investigate this matter and ensure that the establishment is in compliance with all relevant regulations.",web form,awaiting response,low,b3cdcf8f-3c7a-4001-b7fb-646e909d2fa9,40.768273498505636,-73.98231026912883
Sidewalk Obstruction by Outdoor Dining Setup on MacDougal Street (unique_key: 67084024),"I am writing to report that the sidewalk in front of 81 MacDougal Street in Manhattan is currently blocked by an outdoor dining setup. The tables and chairs are extending beyond the designated area and into the pedestrian path, making it difficult for people to walk by. This obstruction is not only an inconvenience but also a safety hazard, especially for those with disabilities or families with strollers. I kindly request that the city take action to ensure the sidewalk is cleared and accessible to all pedestrians.",web form,awaiting response,high,b3cdcf8f-3c7a-4001-b7fb-646e909d2fa9,40.7288245809915,-74.00149371696034
Damaged Do Not Enter Street Sign on 101 Street (unique_key: 67076678),"I am writing to report a damaged street sign at 101 Street in Queens. The ""Do Not Enter"" sign is broken and hanging loosely, which could cause confusion for drivers and potentially lead to accidents. I am concerned about the safety of the community, especially during peak hours, and I believe it is essential to repair or replace the sign as soon as possible. I would appreciate it if someone could look into this matter and take the necessary actions to ensure the sign is restored to its proper condition.",text,awaiting response,medium,b3cdcf8f-3c7a-4001-b7fb-646e909d2fa9,40.76181255620047,-73.86829282639488
Residential Disposal Complaint at 863 East 169 Street (unique_key: 67085462),"I am reporting a disposal issue at 863 East 169 Street in the Bronx, where a residential disposal bin has not been used. The bin is currently located on the sidewalk and appears to be unused, potentially causing an eyesore and a nuisance to the community. As a concerned citizen, I believe it is essential to address this issue to maintain the cleanliness and aesthetic appeal of our neighborhood. I would appreciate it if the relevant authorities could investigate and take necessary actions to resolve this matter.",phone,awaiting response,medium,b3cdcf8f-3c7a-4001-b7fb-646e909d2fa9,40.829098657992446,-73.89697692220842
Rodent Sighting on Fulton Street (unique_key: 67078316),"I am writing to report a rodent sighting on Fulton Street in Brooklyn. Specifically, I saw a rat scurrying around the street/curbside area near 510 Fulton Street. The sighting occurred during daylight hours and I am concerned about the potential health risks associated with rodent infestations in the area. I would appreciate it if the city could investigate and take necessary measures to address this issue as soon as possible.",web form,awaiting response,medium,b3cdcf8f-3c7a-4001-b7fb-646e909d2fa9,40.68948256141962,-73.98243213717063
Deceased Cat on Sidewalk at East 131 Street (unique_key: 67083974),"I am reporting a dead cat found on the sidewalk at East 131 Street in Manhattan. The cat appears to have been there for some time and is causing a disturbance in the area. I am concerned about the potential health and safety implications for nearby residents, especially children and pets. I kindly request that the city sends someone to collect the carcass as soon as possible.",phone,awaiting response,medium,b3cdcf8f-3c7a-4001-b7fb-646e909d2fa9,40.80952516204141,-73.93788139358821
Residential Waste Disposal Issue on East 169 Street (unique_key: 67081053),"I am reporting a residential disposal complaint where waste has been left in front of a residence other than the one it belongs to, located at 865 East 169 Street in the Bronx. The trash is currently sitting on the sidewalk, creating an eyesore and potentially attracting pests. I am concerned that this may be a recurring issue and would like the city to address the matter as soon as possible. I would appreciate it if someone could investigate and ensure that the waste is properly disposed of and the responsible party is held accountable.",phone,awaiting response,medium,b3cdcf8f-3c7a-4001-b7fb-646e909d2fa9,40.829060170670566,-73.89690832625504
Smoking in Designated Smoke-Free Area at 1120 Rosedale Avenue (unique_key: 67075324),"I am concerned about the repeated instances of smoking and vaping in the residential building located at 1120 Rosedale Avenue in the Bronx. Despite being a designated smoke-free area, residents and visitors are frequently seen smoking and vaping in and around the building, posing a health risk to others. I kindly request that the authorities take necessary measures to enforce the smoke-free policy and ensure a healthier environment for all residents. I would appreciate it if this matter could be addressed promptly to prevent further incidents.",web form,awaiting response,low,b3cdcf8f-3c7a-4001-b7fb-646e909d2fa9,40.82808419778328,-73.86836761149952
Dead Deer on Forest Hill Road (unique_key: 67075282),"I am reporting a dead deer on Forest Hill Road in Staten Island. The animal is located on the street and appears to have been there for some time. I am concerned about the potential health and safety risks it may pose to the community, as well as the unpleasant odor it is causing. I would appreciate it if someone could arrange for its removal as soon as possible.",phone,awaiting response,medium,b3cdcf8f-3c7a-4001-b7fb-646e909d2fa9,40.57083566003277,-74.16982709252079
Obstruction on Delafield Avenue (unique_key: 67082522),I am reporting a cone obstructing the street on Delafield Avenue in Staten Island. The cone is currently located on the street and is causing a hazard for drivers and pedestrians. I am concerned that it may cause an accident if not removed promptly. I would appreciate it if the city could send someone to remove the cone as soon as possible.,web form,awaiting response,low,b3cdcf8f-3c7a-4001-b7fb-646e909d2fa9,40.62934319760249,-74.12292190659542
Dead Deer on Forest Hill Road (unique_key: 67081088),"I am reporting a deceased deer on Forest Hill Road in Staten Island. The animal appears to have been struck by a vehicle and is currently lying in the street, posing a potential hazard to drivers and pedestrians. I am concerned about the safety and sanitation of the area, and I kindly request that the city arrange for its removal as soon as possible. I would appreciate it if this matter could be addressed promptly to prevent any further issues.",web form,awaiting response,medium,b3cdcf8f-3c7a-4001-b7fb-646e909d2fa9,40.57083566003277,-74.16982709252079
Indoor Air Quality Issue in 3+ Family Apartment Building (unique_key: 67083741),"I am a concerned resident of 556 82nd Street in Brooklyn, and I am reaching out to report a persistent indoor air quality issue in our 3+ family apartment building. The air inside the building often smells musty and stale, and I have noticed that it exacerbates my allergies and respiratory issues. I have tried to identify the source of the problem, but it seems to be a building-wide issue, possibly related to the ventilation system or moisture accumulation. I would greatly appreciate it if someone could investigate this matter and take necessary steps to improve the indoor air quality in our building.",web form,awaiting response,medium,b3cdcf8f-3c7a-4001-b7fb-646e909d2fa9,40.62352991829137,-74.02345830844641
Indoor Air Quality Issue in 3+ Family Apartment Building (unique_key: 67076560),"I am a concerned resident of 556 82nd Street in Brooklyn, and I am reaching out to report a persistent indoor air quality issue in my building. The air inside my apartment and the common areas has been consistently musty and stale, and I have noticed a strong odor that seems to be coming from the ventilation system. I am worried about the potential health impacts of this issue, particularly for vulnerable residents such as the elderly and young children, and I would appreciate it if someone could investigate and address this problem as soon as possible. I would like to request an inspection and any necessary repairs to ensure a safe and healthy living environment for all residents.",web form,awaiting response,medium,b3cdcf8f-3c7a-4001-b7fb-646e909d2fa9,40.62352991829137,-74.02345830844641
Bus Stop Shelter Lighting Issue at 680 Fort Washington Avenue (unique_key: 67082319),"I am writing to report a lighting issue at the bus stop shelter located at 680 Fort Washington Avenue in Manhattan. The shelter's lighting is not functioning properly, making it difficult for passengers to wait safely at night. As a frequent user of this bus stop, I am concerned about the lack of visibility and potential safety risks it poses. I would appreciate it if this issue could be addressed as soon as possible to ensure the comfort and safety of all passengers.",web form,awaiting response,medium,b3cdcf8f-3c7a-4001-b7fb-646e909d2fa9,40.856777014996844,-73.93583457679512
Street Light Outage on St Nicholas Avenue (unique_key: 67082865),"I am reporting a street light outage on St Nicholas Avenue in Brooklyn. The light is completely out, causing the area to be poorly lit, especially at night. I am concerned about the safety of pedestrians and residents in the area, as the lack of lighting can increase the risk of accidents and crime. I would appreciate it if the city could send someone to repair or replace the street light as soon as possible.",web form,awaiting response,medium,b3cdcf8f-3c7a-4001-b7fb-646e909d2fa9,40.706501051305565,-73.9199217325155
Trash on Vacant Lot at 272 Heberton Avenue (unique_key: 67075291),"I am reporting a concern about a vacant lot located at 272 Heberton Avenue on Staten Island. The lot is filled with trash and debris, creating an eyesore and potential health hazard for the community. As a nearby resident, I am worried about the impact this is having on our neighborhood's appearance and property values. I kindly request that the city takes immediate action to clean up the lot and address this issue.",web form,awaiting response,medium,b3cdcf8f-3c7a-4001-b7fb-646e909d2fa9,40.63404450812861,-74.13324204166062
"Dirty Condition Report at 8904 Avenue M, Brooklyn (unique_key: 67075286)","I am reporting a dirty condition at 8904 Avenue M in Brooklyn, where there is a significant amount of trash accumulated in the yard. The trash is not only an eyesore, but it also poses a health risk to the community. I am concerned that if this issue is not addressed, it may attract pests and create unpleasant odors. I would appreciate it if the city could send someone to clean up the trash and restore the yard to a safe and sanitary condition.",phone,awaiting response,medium,b3cdcf8f-3c7a-4001-b7fb-646e909d2fa9,40.63326790351365,-73.8993040433181
"Rodent Sighting at 228 Sackett Street, Brooklyn (unique_key: 67079684)","I am writing to report a rat sighting at my residential building, located at 228 Sackett Street in Brooklyn. On multiple occasions, I have seen rats scurrying around the exterior and interior of the building, particularly in the basement and near the trash areas. I am concerned about the potential health risks and property damage that these rodents may cause, and I would appreciate it if someone could investigate and take necessary actions to address this issue. I believe that the building's management may need to take measures to seal any entry points and improve waste management to prevent further infestation.",phone,awaiting response,medium,b3cdcf8f-3c7a-4001-b7fb-646e909d2fa9,40.683944947467026,-73.99871641219974
Street Light Outage in Brooklyn (unique_key: 67074190),"I am reporting a street light outage in my neighborhood in Brooklyn. The light has been out for a few days, and it's causing concerns for safety and visibility, especially at night. The darkness is making it difficult for pedestrians and drivers to navigate the area, and I'm worried it may attract crime. I would appreciate it if the city could send someone to repair or replace the street light as soon as possible.",web form,awaiting response,medium,b3cdcf8f-3c7a-4001-b7fb-646e909d2fa9,40.66968334617458,-73.88236050527304
Damaged Sidewalk at 49-67 47th Avenue (unique_key: 67076670),"I am writing to report a hazardous condition on the sidewalk in front of 49-67 47th Avenue in Queens. The sidewalk is broken and uneven, posing a tripping hazard to pedestrians, especially seniors and young children. I am concerned that someone may get injured if this issue is not addressed promptly. I would appreciate it if the city could send someone to repair or replace the damaged sidewalk as soon as possible.",text,awaiting response,high,b3cdcf8f-3c7a-4001-b7fb-646e909d2fa9,40.74076348004444,-73.9155248999684
Damaged Sidewalk at 49-67 47th Avenue (unique_key: 67080944),"I am writing to report a hazardous condition on the sidewalk in front of 49-67 47th Avenue in Queens. The sidewalk is broken and uneven, posing a tripping hazard to pedestrians, especially seniors and young children. I am concerned that someone may get injured if this issue is not addressed promptly. I would appreciate it if the city could send someone to repair or replace the damaged sidewalk as soon as possible.",text,awaiting response,high,b3cdcf8f-3c7a-4001-b7fb-646e909d2fa9,40.74076348004444,-73.9155248999684
Chemical Odors in Commercial Building at 189 East 93rd Street (unique_key: 67083740),"I am writing to report a strong chemical odor in the commercial building located at 189 East 93rd Street in Manhattan. The smell is noticeable throughout the building and appears to be some type of vapor or gas. I am concerned about the potential health risks to occupants and visitors, and I would like the city to investigate and take necessary actions to resolve the issue. The odor has been persistent for several days, and I would appreciate it if someone could look into this matter as soon as possible.",web form,awaiting response,high,b3cdcf8f-3c7a-4001-b7fb-646e909d2fa9,40.78340992809876,-73.95106774533049
Request for Lead Kit at Residential Address (unique_key: 67075335),"I am a concerned homeowner at 585 3rd Avenue in Manhattan, and I am requesting a lead kit to test for potential lead hazards in my home. As a resident of this property, I want to ensure that my living environment is safe and free from lead contamination. I would appreciate it if a lead kit could be provided to me as soon as possible so I can take the necessary steps to protect my health and the health of my family. I am looking forward to receiving the kit and following the instructions to collect and submit the samples for testing.",web form,awaiting response,medium,b3cdcf8f-3c7a-4001-b7fb-646e909d2fa9,40.74847179512637,-73.97611874345195
"Report of Cloudy Water at 30 Cooper Street, Manhattan (unique_key: 67082621)","I am writing to report a concern about the water quality at my residence, 30 Cooper Street in Manhattan. The water appears cloudy or milky, and I am unsure of the cause. I have noticed this issue consistently over the past few days, and I am worried about the potential health implications. I would appreciate it if someone could investigate this matter and take necessary actions to resolve the issue.",web form,awaiting response,medium,b3cdcf8f-3c7a-4001-b7fb-646e909d2fa9,40.86757591236837,-73.92431227328683
Illegal Tree Damage from Bicycle at East 50 Street (unique_key: 67083736),"I am reporting a case of illegal tree damage at 245 East 50 Street in Manhattan, where a bicycle has been chained to a tree, causing harm to the tree's trunk. The bicycle appears to have been locked to the tree for an extended period, and I am concerned about the potential long-term damage to the tree's health. As a resident of this neighborhood, I am worried about the impact this could have on our community's green spaces and would appreciate it if someone could address this issue promptly. I would like the city to take action to remove the bicycle and prevent further damage to the tree.",web form,awaiting response,medium,b3cdcf8f-3c7a-4001-b7fb-646e909d2fa9,40.755389796279935,-73.96971309709203
Illegal Dumping on Chevy Chase Street Sidewalk (unique_key: 67081024),"I am reporting an incident of illegal dumping on the sidewalk in front of 87-25 Chevy Chase Street in Queens. There is a large amount of trash and debris that has been discarded on the sidewalk, creating an eyesore and a potential hazard for pedestrians. I am concerned that if this is not addressed, it will attract pests and create unsanitary conditions. I kindly request that the city remove this illegal dumping as soon as possible to maintain the cleanliness and safety of our neighborhood.",phone,awaiting response,medium,b3cdcf8f-3c7a-4001-b7fb-646e909d2fa9,40.71811904287483,-73.77604313493596
Excessive Noise from Construction Equipment at 60 Wall Street (unique_key: 67081170),I am writing to report excessive noise coming from construction equipment at 60 Wall Street in Manhattan. The constant beeping and rumbling of the machines is disrupting the peace and making it difficult for me to focus at work. The noise has been ongoing for several hours and I am concerned that it may be exceeding acceptable levels. I would appreciate it if someone could investigate this matter and take necessary action to mitigate the disturbance.,web form,awaiting response,low,b3cdcf8f-3c7a-4001-b7fb-646e909d2fa9,40.70591375642571,-74.00860936465871
Damaged Curb on East 86 Street (unique_key: 67078052),"I am reporting a broken curb on the sidewalk in front of 132 East 86 Street in Manhattan. The curb is cracked and uneven, posing a tripping hazard for pedestrians, especially seniors and young children. I am concerned that if this issue is not addressed, it may lead to accidents or injuries. I would appreciate it if the city could repair or replace the damaged curb as soon as possible to ensure the safety of our community.",text,awaiting response,high,b3cdcf8f-3c7a-4001-b7fb-646e909d2fa9,40.77961315742167,-73.95588007365475
Illegal Dumping on Sidewalk at 975 Summit Avenue (unique_key: 67075237),"I am reporting an instance of illegal dumping on the sidewalk in front of 975 Summit Avenue in the Bronx. There is a large amount of trash and debris that has been discarded on the sidewalk, creating an eyesore and a potential hazard for pedestrians. I kindly request that the city sends someone to remove this trash as soon as possible to maintain the cleanliness and safety of our neighborhood. The dumping is clearly visible from the street and is affecting the overall appearance of our community.",text,awaiting response,medium,b3cdcf8f-3c7a-4001-b7fb-646e909d2fa9,40.832636988212734,-73.93053496209842
