ticket_subject,ticket_body,origin,status,priority,reporter_id,lat,lng
"Homeless Person in Need of Assistance at 1025 49th Street, Brooklyn (unique_key: 67085357)",I am concerned about a homeless individual who has been chronically present in front of the commercial store located at 1025 49th Street in Brooklyn. This person appears to be in need of assistance and has been a regular presence at this location for some time. I am worried about their well-being and would like to request that someone from the appropriate agency reach out to provide support and resources. I believe it would be beneficial for this individual to receive guidance on available services and potential housing options.,phone,awaiting response,medium,b3cdcf8f-3c7a-4001-b7fb-646e909d2fa9,40.638738427029665,-73.99824527030135
Illegal Dumping on Sidewalk at 169-10 Hillside Avenue (unique_key: 67085380),"I am reporting an incident of illegal dumping on the sidewalk in front of 169-10 Hillside Avenue in Queens. There is a large amount of trash and debris that has been discarded on the sidewalk, creating an eyesore and a potential health hazard for pedestrians. I kindly request that the city sends a team to remove the dumped materials as soon as possible to restore the cleanliness and safety of our neighborhood. The dumped items are currently obstructing the sidewalk and causing inconvenience to residents and passersby.",phone,awaiting response,medium,b3cdcf8f-3c7a-4001-b7fb-646e909d2fa9,40.71078073687075,-73.79281169918012
Request for Lead Kit at Residential Address (unique_key: 67075338),"I am a concerned homeowner at 44 Ocean Terrace, Staten Island, and I am requesting a lead kit to test my home for potential lead hazards. As a resident of this property, I want to ensure that my living environment is safe and free from lead contamination. I would appreciate it if someone could provide me with a lead kit and guide me through the testing process. I can be reached at my address for kit delivery and any further assistance.",web form,awaiting response,medium,b3cdcf8f-3c7a-4001-b7fb-646e909d2fa9,40.60182538503188,-74.11887756628298
Illegal Construction at Occupied Multiple Dwelling in Brooklyn (unique_key: 67082515),"I am reporting unauthorized construction work being done at 529 80 Street in Brooklyn, which appears to be an occupied multiple dwelling. The work is being performed without any visible permits or inspections, and I am concerned about the safety and well-being of the residents. As a neighbor, I have noticed significant alterations to the building's structure, and I believe it is essential to investigate this matter to ensure compliance with building codes and regulations. I would appreciate it if someone could look into this matter urgently to prevent any potential hazards.",web form,awaiting response,low,b3cdcf8f-3c7a-4001-b7fb-646e909d2fa9,40.625157649820046,-74.02310944696852
Chemical Odor Complaint in 3+ Family Apartment Building (unique_key: 67078040),"I am a concerned resident of 1417 Prospect Place in Brooklyn, and I am writing to report a strong chemical odor in my apartment building. The smell is persistent and seems to be coming from an unknown source, causing discomfort and health concerns for me and my neighbors. I am worried that the odor may be a sign of a larger issue, such as a gas leak or hazardous materials, and I would like the city to investigate and take necessary actions to ensure our safety. I would appreciate it if someone could look into this matter as soon as possible.",phone,awaiting response,high,b3cdcf8f-3c7a-4001-b7fb-646e909d2fa9,40.6732161711646,-73.92979254543171
Dirty Condition on Sidewalk at 377 Seneca Avenue (unique_key: 67078220),"I am writing to report a dirty condition on the sidewalk in front of 377 Seneca Avenue in Queens. The issue is caused by a significant amount of trash that has been left on the sidewalk, creating an unsanitary and unpleasant environment for pedestrians. As a concerned citizen, I am worried about the potential health and safety risks this poses, and I kindly request that the city takes immediate action to clean up the area. I would appreciate it if this matter could be addressed as soon as possible to maintain the cleanliness and beauty of our neighborhood.",text,awaiting response,medium,b3cdcf8f-3c7a-4001-b7fb-646e909d2fa9,40.70710681568104,-73.91493996139684
Illegal After Hours Construction at 459 West 46th Street (unique_key: 67079895),"I am reporting illegal after-hours construction work at 459 West 46th Street in Manhattan. The noise from the site is excessive and disrupting the peace in the neighborhood. As a resident, I am concerned about the safety and quality of life impacts of this unauthorized work. I request that the Emergency Response Team investigate and take immediate action to stop this illegal activity.",web form,awaiting response,high,b3cdcf8f-3c7a-4001-b7fb-646e909d2fa9,40.761868406657975,-73.99283454309553
Poor Ventilation in 3+ Family Apartment Building (unique_key: 67079453),"I am a concerned resident of 105 West 29 Street in Manhattan, and I am reaching out to report a issue with the indoor air quality in our building. The ventilation system seems to be inadequate, leading to stale and stagnant air throughout the apartments, which is causing discomfort and health concerns for the tenants. I have noticed that the air feels thick and musty, especially in the hallways and common areas, and I am worried about the potential long-term effects on our health. I would appreciate it if someone could investigate and take necessary steps to improve the ventilation in our building.",web form,awaiting response,medium,b3cdcf8f-3c7a-4001-b7fb-646e909d2fa9,40.74687918585536,-73.99056970969488
Dirty Condition on 93 Avenue in Queens (unique_key: 67076801),"I am writing to report a dirty condition on 93 Avenue in Queens, where there is an excessive amount of dirt and gravel on the street. The condition is not only unsightly, but it also poses a slipping hazard for pedestrians and could potentially damage vehicles. I am concerned that if this issue is not addressed, it may lead to more serious problems, such as accidents or flooding. I would appreciate it if the city could send someone to clean up the dirt and gravel as soon as possible.",phone,awaiting response,medium,b3cdcf8f-3c7a-4001-b7fb-646e909d2fa9,40.725076484758176,-73.7251097531314
Illegal Tree Damage on Bainbridge Street (unique_key: 67083738),"I am reporting damage to a tree trunk on Bainbridge Street in Brooklyn. The tree, located on the street, has visible damage to its trunk, which appears to be intentional. As a concerned citizen, I am worried about the health and safety of the tree, as well as the potential impact on the surrounding environment. I kindly request that the city inspect and take necessary actions to address this issue and prevent further damage.",web form,awaiting response,medium,b3cdcf8f-3c7a-4001-b7fb-646e909d2fa9,40.683126577752,-73.9123637432668
Request for New Litter Basket on Wickham Avenue Sidewalk (unique_key: 67075241),"I am writing to request a new litter basket to be installed on the sidewalk in front of 4385 Wickham Avenue in the Bronx. The current lack of a litter basket in this location has led to an accumulation of trash and debris on the sidewalk, creating an eyesore and a potential health hazard. I believe a new litter basket would greatly improve the cleanliness and appearance of our neighborhood. I would appreciate it if this request could be addressed as soon as possible.",web form,awaiting response,medium,b3cdcf8f-3c7a-4001-b7fb-646e909d2fa9,40.89763206265242,-73.85025973169954
Rodent Infestation at Winthrop Street Restaurant (unique_key: 67085206),"I am writing to report a disturbing issue at the restaurant located at 843 Winthrop Street in Brooklyn. During my recent visit, I noticed rodents scurrying across the floor, which is a serious concern for public health and safety. The presence of rodents suggests a possible infestation and inadequate waste management, and I am worried that the establishment may not be maintaining a clean and sanitary environment for food preparation and consumption. I kindly request that the relevant authorities inspect the premises and take necessary actions to address this issue.",text,awaiting response,medium,b3cdcf8f-3c7a-4001-b7fb-646e909d2fa9,40.65827195233676,-73.93162118442113
Malfunctioning Traffic Signal Controller in Queens (unique_key: 67084291),"I am writing to report a issue with a traffic signal controller in the Queens borough. The controller appears to be malfunctioning, causing the traffic signal to cycle irregularly and resulting in congestion and potential safety hazards for drivers and pedestrians. I have noticed this issue consistently over the past few days and am concerned that it may lead to accidents if not addressed promptly. I would appreciate it if someone could investigate and repair the controller as soon as possible.",web form,awaiting response,high,b3cdcf8f-3c7a-4001-b7fb-646e909d2fa9,40.755015499443395,-73.93433362303817
Damaged Tree on Nostrand Avenue (unique_key: 67076549),"I am concerned about a tree located on the street at 377A Nostrand Avenue in Brooklyn. A large branch of the tree has cracked and appears to be on the verge of falling, posing a potential hazard to pedestrians and vehicles. I am worried that if the branch falls, it could cause injury or damage to property. I kindly request that the city inspect and address this issue as soon as possible to ensure public safety.",web form,awaiting response,medium,b3cdcf8f-3c7a-4001-b7fb-646e909d2fa9,40.6850157441049,-73.95049093245628
Homeless Person in Need of Assistance at Satterlee Street Park (unique_key: 67082462),I am concerned about a homeless individual who has been consistently present at the park located at 298 Satterlee Street on Staten Island. This person appears to be in need of chronic assistance and has been a regular presence in the area for some time. I am worried about their well-being and would like to request that someone from the appropriate agency reach out to offer support and resources. I believe it would be beneficial for this individual to receive guidance on available services and potential housing options.,text,awaiting response,medium,b3cdcf8f-3c7a-4001-b7fb-646e909d2fa9,40.50235636682173,-74.25143969756395
Defective Street Hardware on Linden Boulevard (unique_key: 67080950),"I am writing to report a defective street hardware issue on Linden Boulevard, specifically at the address 203-07. The hardware in question appears to be a broken or loose manhole cover, which is causing a loud noise and a potential hazard for drivers and pedestrians. I am concerned that if this issue is not addressed, it could lead to accidents or further damage to the surrounding infrastructure. I would appreciate it if someone could investigate and repair or replace the defective hardware as soon as possible.",phone,awaiting response,high,b3cdcf8f-3c7a-4001-b7fb-646e909d2fa9,40.69527672077182,-73.74926802602405
Dead Tree on 67 Avenue in Queens (unique_key: 67078031),"I am concerned about a tree located on 67 Avenue in front of 95-04, which appears to be dead or dying. The tree was planted more than two years ago, but it has not thrived and is now a potential hazard. I am worried that if it falls, it could damage nearby properties or injure pedestrians. I would greatly appreciate it if the city could inspect and remove the tree if necessary to ensure public safety.",web form,awaiting response,medium,b3cdcf8f-3c7a-4001-b7fb-646e909d2fa9,40.721627085854045,-73.85717777629928
Residential Waste Disposal Issue on West 36 Street (unique_key: 67081054),"I am reporting a residential disposal complaint where waste has been left in front of a residence other than the one it belongs to, located at 449 West 36 Street in Manhattan. The trash is currently sitting on the sidewalk, and it's causing an eyesore and potentially attracting pests. I believe the waste was mistakenly or intentionally placed in front of the wrong building, and I would appreciate it if the city could assist in resolving this issue. The improper disposal of waste is not only unsightly, but it also poses health and safety concerns for the community.",phone,awaiting response,medium,b3cdcf8f-3c7a-4001-b7fb-646e909d2fa9,40.75560784242531,-73.99757444107091
Request for Lead Kit at Residential Address (unique_key: 67079709),"I am concerned about potential lead exposure in my home and would like to request a lead kit to test for lead levels. I reside at 25-66 46 Street in Queens, zip code 11103, and am worried about the health and safety of my family. I would greatly appreciate it if a lead kit could be provided to help me assess the situation and take necessary precautions. Please arrange for a kit to be sent to my address as soon as possible.",web form,awaiting response,medium,b3cdcf8f-3c7a-4001-b7fb-646e909d2fa9,40.765289684223326,-73.90726662646875
Non-Food Vendor Operating Without Permit on Broadway (unique_key: 67078275),"I am reporting a non-food vendor operating on the street at 1585 Broadway in Manhattan. The vendor appears to be selling merchandise without a permit, and I am concerned that they may be obstructing pedestrian traffic or violating local regulations. As a frequent visitor to this area, I would like to request that the city take action to enforce vendor regulations and ensure that all vendors are operating legally. I would appreciate it if someone could investigate this issue and take necessary steps to address the problem.",web form,awaiting response,medium,b3cdcf8f-3c7a-4001-b7fb-646e909d2fa9,40.760215360467875,-73.98533373855116
Deceased Cat on Sidewalk in Queens (unique_key: 67083975),"I am reporting a dead cat on the sidewalk in front of 45-67 165 Street in Queens. The animal appears to have been there for some time and is causing a disturbance in the neighborhood. I am concerned about the potential health risks and unpleasant odor it may be causing, and I would appreciate it if someone could collect the carcass as soon as possible. I would like to request that the appropriate department be notified to handle the removal of the deceased animal.",phone,awaiting response,medium,b3cdcf8f-3c7a-4001-b7fb-646e909d2fa9,40.75427922394155,-73.80188759438869
Adjacent Buildings Not Protected During Construction at 80-54 192 Street (unique_key: 67079896),"I am concerned about the construction site at 80-54 192 Street in Queens, where the adjacent buildings do not appear to be properly protected from the ongoing work. As a nearby resident, I have noticed that the scaffolding and other safety measures seem to be inadequate, posing a potential risk to the neighboring properties. I am worried that if the situation is not addressed, it could lead to damage or other safety hazards. I would appreciate it if the city could inspect the site and ensure that the necessary precautions are taken to safeguard the adjacent buildings.",web form,awaiting response,medium,b3cdcf8f-3c7a-4001-b7fb-646e909d2fa9,40.72897022378723,-73.7780379882904
"Request for Lead Kit at 80 Fenimore Street, Brooklyn (unique_key: 67073910)","I am a concerned homeowner at 80 Fenimore Street in Brooklyn, and I am requesting a lead kit to test for potential lead hazards in my residential property. As a resident of this home, I want to ensure that my living environment is safe and free from lead contamination. I would appreciate it if a lead kit could be provided to me as soon as possible so I can take the necessary steps to protect my health and the health of my family. I look forward to receiving the kit and any additional guidance on how to proceed with the testing process.",web form,awaiting response,medium,b3cdcf8f-3c7a-4001-b7fb-646e909d2fa9,40.658131385738066,-73.95934835625354
Idling Vehicle Causing Strong Odor on West 55 Street (unique_key: 67079708),I am reporting a strong odor of fumes coming from a vehicle that has been idling for an extended period on West 55 Street. The smell is unbearable and is causing a nuisance to the surrounding area. I am concerned about the air quality and the potential health risks it poses to pedestrians and residents nearby. I would appreciate it if someone could investigate and take necessary action to address this issue.,web form,awaiting response,medium,b3cdcf8f-3c7a-4001-b7fb-646e909d2fa9,40.762343817961494,-73.9765000212024
Unlicensed Food Vendor on Main Street in Queens (unique_key: 67076796),"I am writing to report a food vendor operating on the street at 39-22 Main Street in Queens without a visible license or permit. The vendor is selling food to pedestrians and appears to be doing so on a regular basis, which is causing concern for the safety and health of the community. I have seen this vendor in operation for several days and would like the city to take action to ensure they are complying with all necessary regulations. I would appreciate it if someone could investigate this matter and take the necessary steps to address the issue.",phone,awaiting response,medium,b3cdcf8f-3c7a-4001-b7fb-646e909d2fa9,40.76005300649144,-73.83038714236044
"Inadequate Sidewalk Shed at 239 Ocean Avenue, Brooklyn (unique_key: 67084220)","I am writing to report a concern with the sidewalk shed at 239 Ocean Avenue in Brooklyn. The shed appears to be inadequate and defective, with exposed pipes and scaffolding that poses a hazard to pedestrians. As someone who frequently walks by this location, I am worried about the potential risk of injury or accident. I kindly request that the city inspect and address this issue as soon as possible to ensure public safety.",web form,awaiting response,medium,b3cdcf8f-3c7a-4001-b7fb-646e909d2fa9,40.65698230332589,-73.96222514965272
"Illegal Dumping on Sidewalk at 276 West 71 Street, Manhattan (unique_key: 67075233)","I am reporting an instance of illegal dumping on the sidewalk in front of 276 West 71 Street in Manhattan. There is a large amount of trash and debris that has been discarded on the sidewalk, creating an eyesore and a potential health hazard for pedestrians. I kindly request that the city sends someone to remove this waste as soon as possible to maintain the cleanliness and safety of our neighborhood. The dumped materials are currently obstructing the sidewalk and causing inconvenience to residents and visitors.",phone,awaiting response,medium,b3cdcf8f-3c7a-4001-b7fb-646e909d2fa9,40.778808084786974,-73.98424642734976
"Excessive Barking Dog Noise at 15 West 53 Street, Manhattan (unique_key: 67076852)",I am writing to report a noise complaint regarding a barking dog at 15 West 53 Street in Manhattan. The constant barking has been disrupting my daily activities and I am concerned that it may be a disturbance to other neighbors as well. The barking has been ongoing for several hours and I would appreciate it if someone could look into this matter and take necessary actions to resolve the issue. I would like to request assistance in addressing this noise complaint as soon as possible.,web form,awaiting response,low,b3cdcf8f-3c7a-4001-b7fb-646e909d2fa9,40.7610374767395,-73.97728018962987
Missed Bulky Recycling Collection on Sterling Street (unique_key: 67081028),"I am reporting a missed bulky recycling collection at my address, 283 Sterling Street in Brooklyn. The scheduled collection date has passed, but the items I placed outside for pickup were not taken. I had set out the appropriate materials for bulky recycling, following all guidelines, but they remain on the curb. I would appreciate it if the collection could be rescheduled as soon as possible to address this issue.",phone,awaiting response,medium,b3cdcf8f-3c7a-4001-b7fb-646e909d2fa9,40.663074582472184,-73.95184447066342
Unauthorized Food Vendor on Washington Street (unique_key: 67085424),"I am reporting an unauthorized food vendor operating on the street at 60 Washington Street in Brooklyn. The vendor appears to be selling food without proper permits or licenses, and I am concerned about the potential health and safety risks to the community. The vendor is set up on the sidewalk and is attracting a large crowd, causing congestion and disrupting pedestrian traffic. I would appreciate it if someone could investigate and take appropriate action to ensure that the vendor is operating in compliance with city regulations.",web form,awaiting response,medium,b3cdcf8f-3c7a-4001-b7fb-646e909d2fa9,40.70238933424343,-73.9896418985703
Damaged Tree with Fallen Branch on 32 Avenue (unique_key: 67083728),"I am reporting a damaged tree located on 32 Avenue near my residence at 165-02 32 Avenue in Queens. A large branch has fallen from the tree and is currently obstructing the street, posing a potential hazard to pedestrians and vehicles. I am concerned that if not removed, it could cause an accident or damage to nearby properties. I kindly request that the city sends someone to remove the fallen branch and assess the tree's condition to prevent any further incidents.",phone,awaiting response,medium,b3cdcf8f-3c7a-4001-b7fb-646e909d2fa9,40.76909728471707,-73.79981096996558
Injured Wildlife in Pelham Bay Park (unique_key: 67074667),"I am reporting an injured animal in Pelham Bay Park, located in the Bronx. While walking through the park, I came across a wounded bird that appears to be in distress and is unable to fly. The bird is currently located near a large tree, and I am concerned for its well-being. I would greatly appreciate it if someone could send assistance to help this injured animal as soon as possible.",web form,awaiting response,medium,b3cdcf8f-3c7a-4001-b7fb-646e909d2fa9,40.86747358275403,-73.8094430998493
Damaged Sidewalk at 87-40 127 Street in Queens (unique_key: 67080947),"I am writing to report a sidewalk violation at 87-40 127 Street in the Queens borough. The sidewalk in front of this address is damaged, posing a tripping hazard to pedestrians, especially seniors and young children. The uneven and cracked pavement needs to be repaired to ensure public safety. I kindly request that the responsible authorities inspect and repair the sidewalk as soon as possible.",phone,awaiting response,high,b3cdcf8f-3c7a-4001-b7fb-646e909d2fa9,40.7003496410097,-73.82352443881543
Excessive Construction Noise at 200 West 88 Street (unique_key: 67082596),"I am writing to report excessive construction noise at 200 West 88 Street in Manhattan. The noise is occurring outside of regular construction hours, disrupting the peace and quiet of our neighborhood. As a resident, I am concerned about the impact this noise is having on our quality of life, and I kindly request that the city take action to address this issue. I would appreciate it if someone could look into this matter and ensure that construction activities are being conducted within the permitted hours.",web form,awaiting response,low,b3cdcf8f-3c7a-4001-b7fb-646e909d2fa9,40.78906610369047,-73.97426604257923
"Dirty Water Complaint at 69 Kingdom Avenue, Staten Island (unique_key: 67075368)","I am writing to report a concern about the water quality at my residence, 69 Kingdom Avenue, in the Staten Island borough. The water coming out of my faucets is dirty and discolored, which is causing me distress and uncertainty about its safety for consumption. I have noticed this issue for the past few days and it seems to be persistent, prompting me to reach out for assistance in resolving this matter. I would appreciate it if someone could investigate and address this problem as soon as possible.",phone,awaiting response,medium,b3cdcf8f-3c7a-4001-b7fb-646e909d2fa9,40.530994951741775,-74.18897163222208
Debris on Street from Car Accident at 162 East 25th Street (unique_key: 67076786),"I am reporting a dirty condition on the street at 162 East 25th Street in Manhattan due to debris from a recent car accident. The accident has left behind broken glass, twisted metal, and other hazardous materials that pose a risk to pedestrians and drivers. I am concerned that if this debris is not cleaned up promptly, it could cause injuries or further accidents. I would appreciate it if the city could send someone to clean up the area as soon as possible.",web form,awaiting response,medium,b3cdcf8f-3c7a-4001-b7fb-646e909d2fa9,40.74027988170914,-73.98262443530332
Dirty Condition on Sidewalk at 2887 Reservoir Avenue (unique_key: 67081016),"I am writing to report a dirty condition on the sidewalk in front of 2887 Reservoir Avenue in the Bronx. The area is littered with trash, creating an unsightly and unsanitary environment for pedestrians. As a concerned citizen, I am worried about the impact this has on our community's health and appearance. I kindly request that the city sends someone to clean up the trash and restore the area to a clean and safe condition.",text,awaiting response,medium,b3cdcf8f-3c7a-4001-b7fb-646e909d2fa9,40.87061601666171,-73.89802985217285
Defective Street Hardware on Dean Street in Brooklyn (unique_key: 67083840),"I am writing to report a defective street hardware issue on Dean Street in Brooklyn. Specifically, the hardware in question appears to be a broken or malfunctioning manhole cover or street plate, which is causing an uneven road surface and potentially posing a hazard to drivers and pedestrians. The issue is located on Dean Street, near the address 660 Dean Street, and I am concerned that it may lead to accidents or damage to vehicles if not addressed promptly. I would appreciate it if the city could send someone to inspect and repair the defective hardware as soon as possible.",web form,awaiting response,high,b3cdcf8f-3c7a-4001-b7fb-646e909d2fa9,40.68032856649693,-73.96866196525144
